{
  "_id": "69429/c0183435vx78",
  "_rev": "10-90b497da11389fe9f26965eaf852b8e5",
  "source": {
    "path": "oocihm.8_06941_2/data/sip/data/files/0003.jpg",
    "from": "cihm"
  },
  "ocrType": "alto",
  "ocrPdf": {
    "extension": "pdf",
    "size": 1312895
  },
  "master": {
    "width": 3264,
    "size": 1999647,
    "extension": "jpg",
    "height": 4208,
    "md5": "50e77dafd5a0a27305395c5532060575",
    "mime": "image/jpeg"
  }
}
