{
  "_id": "69429/c02805046f82",
  "_rev": "7-f0e74d307a04297aed4134dd85a279e0",
  "master": {
    "md5": "0a5157bc03748e14a35c568cb72e7da8",
    "extension": "jpg",
    "height": 4160,
    "mime": "image/jpeg",
    "size": 1673911,
    "width": 3480
  },
  "source": {
    "from": "cihm",
    "path": "oocihm.8_06941_1/data/sip/data/files/0003.jpg"
  },
  "ocrPdf": {
    "md5": "a490f635ca35e8edb3af25f6b57a623f",
    "extension": "pdf",
    "size": 1281330
  },
  "ocrType": "alto"
}
