{
  "_id": "69429/c0z02z51z77x",
  "_rev": "4-fe47e5211e1718d51d6e37f6dcb3bfb8",
  "source": {
    "from": "cihm",
    "path": "oocihm.45116/data/sip/data/files/oocihm.45116.0003.tif"
  },
  "master": {
    "width": 2243,
    "md5": "80145897f6178ce4a8af7b9367e8ef70",
    "extension": "tif",
    "size": 74135,
    "height": 3654,
    "mime": "image/tiff"
  },
  "ocrPdf": {
    "md5": "b2e3a36ecab4401782b726024f827c10",
    "size": 75402,
    "extension": "pdf"
  },
  "ocrType": "txtmap"
}
