{
  "_id": "69429/c0n00zr2z33x",
  "_rev": "1-d48be52157ebaa671b64ca3ab7f0fe98",
  "master": {
    "mime": "image/jpeg",
    "width": 2984,
    "size": 1968137,
    "height": 4192,
    "path": "oocihm.8_06941_2/data/sip/data/files/0006.jpg"
  },
  "source": {
    "from": "cihm",
    "path": "oocihm.8_06941_2/data/sip/data/files/0006.jpg"
  },
  "ocrPdf": {
    "path": "oocihm.8_06941_2/data/sip/data/files/0006.pdf",
    "size": 1251828
  },
  "ocrType": "alto"
}
