{
  "_id": "69429/c0610vs1v70v",
  "_rev": "5-2ac85bd2333feea014d41b3e96320d49",
  "ocrPdf": {
    "extension": "pdf",
    "md5": "bc5742709b15d268d4a3f62956f59e09",
    "size": 1181453
  },
  "master": {
    "mime": "image/jpeg",
    "width": 2992,
    "size": 1794509,
    "md5": "acb2a70c57baf5094ad094fbe41eeae7",
    "height": 4160,
    "extension": "jpg"
  },
  "ocrType": "alto",
  "source": {
    "path": "oocihm.8_06941_1/data/sip/data/files/0002.jpg",
    "from": "cihm"
  }
}
