{
  "_id": "69429/c0j678v3mt8m",
  "_rev": "5-bbf2c762e6f489cb204bd6df64608629",
  "source": {
    "path": "oocihm.8_06941_1/data/sip/data/files/0007.jpg",
    "from": "cihm"
  },
  "ocrPdf": {
    "size": 1221347,
    "extension": "pdf",
    "md5": "176717ba7ee74363c74b8ecb18b3c088"
  },
  "master": {
    "md5": "d8c7a0f074ab91672e0f7470728e67fd",
    "extension": "jpg",
    "width": 3464,
    "mime": "image/jpeg",
    "height": 4208,
    "size": 1936497
  },
  "ocrType": "alto"
}
